asset_id,team,owner,source_url,source_org,license_or_usage_notes,asset_type,original_format,final_path,intended_use,training_use,status,reviewer,date_added,conversion_notes
jwst_3d_001,team1,asset_provenance_lead,https://science.nasa.gov/3d-resources/james-webb-space-telescope-b/,NASA,Review NASA image and media guidelines before publication,external_geometry_reference,3D resource landing page,assets/jwst/,JWST geometry and component reference only,prohibited,selected,Codex,2026-06-26,Selected as Week 2 source page; page identifies NASA/Christopher R. Meaney and a GLB download.
jwst_nasa_glb_2025,team1,asset_provenance_lead,https://assets.science.nasa.gov/content/dam/science/cds/3d/resources/model/james-webb-space-telescope-%28b%29/James%20Webb%20Space%20Telescope%20%28B%29.glb,NASA/NASA Science,Review NASA image and media guidelines before publication,external_geometry_asset,GLB,assets/jwst/external/jwst_nasa_glb_2025.glb,Selected Week 2 JWST source asset for later isolated conversion and component mapping,prohibited,selected,Codex,2026-06-26,Do not commit downloaded GLB; source page lists James Webb Space Telescope B GLB at about 980.71 KB and source NASA/Christopher R. Meaney.
webb_images_001,team1,asset_provenance_lead,https://webbtelescope.org/images,STScI/NASA,Reference and validation only; science images cannot validate spacecraft geometry,external_reference_collection,web image collection,validation/reference_manifest.csv,External validation reference discovery,prohibited,planned,,2026-06-26,Selected references must be added as separate manifest rows before use.
nasa_images_001,team1,asset_provenance_lead,https://images.nasa.gov/,NASA,Reference and validation only,external_reference_collection,web image collection,validation/reference_manifest.csv,JWST build deployment and component reference discovery,prohibited,planned,,2026-06-26,Selected images must record source URLs and intended validation use.
jwst_proxy_scene_001,team1,scene_lead,local://usd/jwst_inspect_root.usd,JWST-Inspect team,Generated proxy geometry; no external asset content,proxy_scene,OpenUSD ASCII,usd/jwst_inspect_root.usd,Week 1 proxy scene for contracts and downstream smoke tests,proxy_only,created,Codex,2026-06-26,Primitive OpenUSD proxy with stable paths and no claim of flight accuracy.
inspector_proxy_001,team1,scene_lead,local://usd/layers/geometry.usd,JWST-Inspect team,Generated proxy geometry; no external asset content,proxy_inspector,OpenUSD ASCII,usd/layers/geometry.usd,Inspector microsatellite proxy with body panels and sensor frames,proxy_only,created,Codex,2026-06-26,Simple primitive geometry intended for frame and contract validation only.
